<?xml version="1.0" encoding="ISO-8859-1"?>
<newspaper xmlns:xsi="http://www.w3.org/2001/XMLSchema-instance"
xsi:noNamespaceSchemaLocation="newspaper.xsd">
<article author="harry" editor="potter" date="09/11" edition="first">
<headline>bangbang</headline>
<byline>b2b2</byline>
<lead>leeeeead</lead>
<body>sline</body>
<notes>death</notes>
</article>
<newspapers/>
<publisher/>
<copyright/>
</newspaper>

